<?xml version="1.0" ?>

<autobusu_parkas xmlns="http://www.grma3240.lt/autobusu_parkas"
	xmlns:xsi="http://www.w3.org/2001/XMLSchema-instance"
    xsi:noNamespaceSchemaLocation="http://www.grma3240.lt/autobusu_parkas 2_uzd.xsd">
	<pavadinimas>UAB Vilniaus Viešasis Transportas</pavadinimas>
	<transporto_priemones>
		<autobusas id="TP1" tipas="tarpmiestinis">
			<pagaminimo_data>2003-04-23</pagaminimo_data>
			<marke>Iveco</marke>
			<marsrutas>3</marsrutas>
			<kuro_tipas>benzinas</kuro_tipas>
			<!--kuro sanaudos 100 km-->
			<vid_kuro_sanaudos>30.2</vid_kuro_sanaudos>
			<vairuotojas ref="v1"/> 
		</autobusas>
		<autobusas id="TP2" tipas="tarpmiestinis">
			<pagaminimo_data>2007-10-13</pagaminimo_data>
			<marke>MAN</marke>
			<marsrutas>1</marsrutas>
			<kuro_tipas>dyzelis</kuro_tipas>
			<!--kuro sanaudos 100 km-->
			<vid_kuro_sanaudos>29.5</vid_kuro_sanaudos>
			<vairuotojas ref="v3"/> 
		</autobusas>
		<autobusas id="TP3" tipas="miesto">
			<pagaminimo_data>2010-09-04</pagaminimo_data>
			<marke>Volvo</marke>
			<marsrutas>2G</marsrutas>
			<kuro_tipas>dyzelis</kuro_tipas>
			<!--kuro sanaudos 100 km-->
			<vid_kuro_sanaudos>31.7</vid_kuro_sanaudos>
			<vairuotojas ref="v2"/> 
		</autobusas>
		<mikroautobusas id="TP4" tipas="miesto">
			<pagaminimo_data>2010-09-04</pagaminimo_data>
			<marke>Volvo</marke>
			<marsrutas>2G</marsrutas>
			<kuro_tipas>dyzelis</kuro_tipas>
			<!--kuro sanaudos 100 km-->
			<vid_kuro_sanaudos>31.7</vid_kuro_sanaudos>
			<vairuotojas ref="v2"/> 
		</mikroautobusas>
	</transporto_priemones>
	<ppl:darbuotojai xmlns:ppl="http://www.grma3240.lt/zmones">
		<ppl:vairuotojas id="v1">
			<vardas>Leonidas</vardas>
			<pavarde>Antonovičius</pavarde>
			<gimimo_data>1986-07-14</gimimo_data>
			<AK>38607143456</AK>
		</ppl:vairuotojas>
		<ppl:vairuotojas id="v2">
			<vardas>Eleonora</vardas>
			<pavarde>Mažeikienė</pavarde>
			<gimimo_data>1989-12-01</gimimo_data>
			<AK>48912017382</AK>
		</ppl:vairuotojas>
		<ppl:vairuotojas id="v3">
			<vardas>Mantas</vardas>
			<pavarde>Gutaravičius</pavarde>
			<gimimo_data>1979-11-04</gimimo_data>
			<AK>37911046682</AK>
			<teisiu_kategorijos></teisiu_kategorijos>
		</ppl:vairuotojas>
	</ppl:darbuotojai>
</autobusu_parkas>